Sheet: Arkusz1
A1: MODIFIED MILK
A2: Time | B2: Food in ml per 1 feeding | C2: Amount of feeding | D2: Total amount of food in ml
A3: 1 | B3: 10 | C3: 10 | D3: of:=[.B3]*[.C3] -> 100
A4: 2 | B4: 20 | C4: 10 | D4: of:=[.B4]*[.C4] -> 200
A5: 3 | B5: 30 | C5: 10 | D5: of:=[.B5]*[.C5] -> 300
A6: 4 | B6: 40 | C6: 10 | D6: of:=[.B6]*[.C6] -> 400
A7: 5 | B7: 50 | C7: 10 | D7: of:=[.B7]*[.C7] -> 500
A8: 6 | B8: 60 | C8: 10 | D8: of:=[.B8]*[.C8] -> 600
A9: 7 | B9: 70 | C9: 10 | D9: of:=[.B9]*[.C9] -> 700
A10: 8 | B10: 80 | C10: 9 | D10: of:=[.B10]*[.C10] -> 720
A11: 9 | B11: 90 | C11: 8 | D11: of:=[.B11]*[.C11] -> 720
A12: 10 | B12: 90 | C12: 8 | D12: of:=[.B12]*[.C12] -> 720
A13: 11 | B13: 90 | C13: 8 | D13: of:=[.B13]*[.C13] -> 720
A14: 12 | B14: 90 | C14: 8 | D14: of:=[.B14]*[.C14] -> 720
A15: 13 | B15: 90 | C15: 8 | D15: of:=[.B15]*[.C15] -> 720
A16: 14 | B16: 90 | C16: 8 | D16: of:=[.B16]*[.C16] -> 720
A17: 15 | B17: 100 | C17: 8 | D17: of:=[.B17]*[.C17] -> 800
A18: 16 | B18: 100 | C18: 8 | D18: of:=[.B18]*[.C18] -> 800
A19: 17 | B19: 100 | C19: 8 | D19: of:=[.B19]*[.C19] -> 800
A20: 18 | B20: 100 | C20: 8 | D20: of:=[.B20]*[.C20] -> 800
A21: 19 | B21: 100 | C21: 8 | D21: of:=[.B21]*[.C21] -> 800
A22: 20 | B22: 100 | C22: 8 | D22: of:=[.B22]*[.C22] -> 800
A23: 21 | B23: 100 | C23: 8 | D23: of:=[.B23]*[.C23] -> 800
A24: 22 | B24: 100 | C24: 8 | D24: of:=[.B24]*[.C24] -> 800
A25: 23 | B25: 100 | C25: 8 | D25: of:=[.B25]*[.C25] -> 800
A26: 24 | B26: 100 | C26: 8 | D26: of:=[.B26]*[.C26] -> 800
A27: 25 | B27: 110 | C27: 7 | D27: of:=[.B27]*[.C27] -> 770
A28: 26 | B28: 110 | C28: 7 | D28: of:=[.B28]*[.C28] -> 770
A29: 27 | B29: 110 | C29: 7 | D29: of:=[.B29]*[.C29] -> 770
A30: 28 | B30: 110 | C30: 7 | D30: of:=[.B30]*[.C30] -> 770
A31: 29 | B31: 110 | C31: 7 | D31: of:=[.B31]*[.C31] -> 770
A32: 30 | B32: 110 | C32: 7 | D32: of:=[.B32]*[.C32] -> 770
A33: 31 | B33: 110 | C33: 7 | D33: of:=[.B33]*[.C33] -> 770
A34: 32 | B34: 120 | C34: 7 | D34: of:=[.B34]*[.C34] -> 840
A35: 33 | B35: 120 | C35: 7 | D35: of:=[.B35]*[.C35] -> 840
A36: 34 | B36: 120 | C36: 7 | D36: of:=[.B36]*[.C36] -> 840
A37: 35 | B37: 120 | C37: 7 | D37: of:=[.B37]*[.C37] -> 840
A38: 36 | B38: 120 | C38: 7 | D38: of:=[.B38]*[.C38] -> 840
A39: 37 | B39: 120 | C39: 7 | D39: of:=[.B39]*[.C39] -> 840
A40: 38 | B40: 120 | C40: 7 | D40: of:=[.B40]*[.C40] -> 840
A41: 39 | B41: 130 | C41: 7 | D41: of:=[.B41]*[.C41] -> 910
A42: 40 | B42: 130 | C42: 7 | D42: of:=[.B42]*[.C42] -> 910
A43: 41 | B43: 130 | C43: 7 | D43: of:=[.B43]*[.C43] -> 910
A44: 42 | B44: 130 | C44: 7 | D44: of:=[.B44]*[.C44] -> 910
A45: 43 | B45: 130 | C45: 7 | D45: of:=[.B45]*[.C45] -> 910
A46: 44 | B46: 130 | C46: 7 | D46: of:=[.B46]*[.C46] -> 910
A47: 45 | B47: 130 | C47: 7 | D47: of:=[.B47]*[.C47] -> 910
A48: 46 | B48: 130 | C48: 7 | D48: of:=[.B48]*[.C48] -> 910
A49: 47 | B49: 130 | C49: 7 | D49: of:=[.B49]*[.C49] -> 910
A50: 48 | B50: 130 | C50: 7 | D50: of:=[.B50]*[.C50] -> 910
A51: 49 | B51: 130 | C51: 7 | D51: of:=[.B51]*[.C51] -> 910
A52: 50 | B52: 130 | C52: 7 | D52: of:=[.B52]*[.C52] -> 910
A53: 51 | B53: 130 | C53: 7 | D53: of:=[.B53]*[.C53] -> 910
A54: 52 | B54: 130 | C54: 7 | D54: of:=[.B54]*[.C54] -> 910
A55: 53 | B55: 140 | C55: 6 | D55: of:=[.B55]*[.C55] -> 840
A56: 54 | B56: 140 | C56: 6 | D56: of:=[.B56]*[.C56] -> 840
A57: 55 | B57: 140 | C57: 6 | D57: of:=[.B57]*[.C57] -> 840
A58: 56 | B58: 140 | C58: 6 | D58: of:=[.B58]*[.C58] -> 840
A59: 57 | B59: 140 | C59: 6 | D59: of:=[.B59]*[.C59] -> 840
A60: 58 | B60: 140 | C60: 6 | D60: of:=[.B60]*[.C60] -> 840
A61: 59 | B61: 140 | C61: 6 | D61: of:=[.B61]*[.C61] -> 840
A62: 60 | B62: 140 | C62: 6 | D62: of:=[.B62]*[.C62] -> 840
A63: 61 | B63: 140 | C63: 6 | D63: of:=[.B63]*[.C63] -> 840
A64: 62 | B64: 140 | C64: 6 | D64: of:=[.B64]*[.C64] -> 840
A65: 63 | B65: 140 | C65: 6 | D65: of:=[.B65]*[.C65] -> 840
A66: 64 | B66: 140 | C66: 6 | D66: of:=[.B66]*[.C66] -> 840
A67: 65 | B67: 140 | C67: 6 | D67: of:=[.B67]*[.C67] -> 840
A68: 66 | B68: 140 | C68: 6 | D68: of:=[.B68]*[.C68] -> 840
A69: 67 | B69: 140 | C69: 6 | D69: of:=[.B69]*[.C69] -> 840
A70: 68 | B70: 140 | C70: 6 | D70: of:=[.B70]*[.C70] -> 840
A71: 69 | B71: 140 | C71: 6 | D71: of:=[.B71]*[.C71] -> 840
A72: 70 | B72: 140 | C72: 6 | D72: of:=[.B72]*[.C72] -> 840
A73: 71 | B73: 140 | C73: 6 | D73: of:=[.B73]*[.C73] -> 840
A74: 72 | B74: 140 | C74: 6 | D74: of:=[.B74]*[.C74] -> 840
A75: 73 | B75: 140 | C75: 6 | D75: of:=[.B75]*[.C75] -> 840
A76: 74 | B76: 140 | C76: 6 | D76: of:=[.B76]*[.C76] -> 840
A77: 75 | B77: 140 | C77: 6 | D77: of:=[.B77]*[.C77] -> 840
A78: 76 | B78: 150 | C78: 6 | D78: of:=[.B78]*[.C78] -> 900
A79: 77 | B79: 150 | C79: 6 | D79: of:=[.B79]*[.C79] -> 900
A80: 78 | B80: 150 | C80: 6 | D80: of:=[.B80]*[.C80] -> 900
A81: 79 | B81: 150 | C81: 6 | D81: of:=[.B81]*[.C81] -> 900
A82: 80 | B82: 150 | C82: 6 | D82: of:=[.B82]*[.C82] -> 900
A83: 81 | B83: 150 | C83: 6 | D83: of:=[.B83]*[.C83] -> 900
A84: 82 | B84: 150 | C84: 6 | D84: of:=[.B84]*[.C84] -> 900
A85: 83 | B85: 150 | C85: 6 | D85: of:=[.B85]*[.C85] -> 900
A86: 84 | B86: 150 | C86: 6 | D86: of:=[.B86]*[.C86] -> 900
A87: 85 | B87: 150 | C87: 6 | D87: of:=[.B87]*[.C87] -> 900
A88: 86 | B88: 150 | C88: 6 | D88: of:=[.B88]*[.C88] -> 900
A89: 87 | B89: 150 | C89: 6 | D89: of:=[.B89]*[.C89] -> 900
A90: 88 | B90: 150 | C90: 6 | D90: of:=[.B90]*[.C90] -> 900
A91: 89 | B91: 150 | C91: 6 | D91: of:=[.B91]*[.C91] -> 900
A92: 90 | B92: 150 | C92: 6 | D92: of:=[.B92]*[.C92] -> 900